{
  "$schema": "../../../../schema/catalog_entry.schema.json",
  "ref": "dnd5e/creature/venomous-snake",
  "kind": "creature",
  "name": "Venomous Snake",
  "schema_version": "1.0",
  "source": {
    "system": "dnd5e",
    "document": "srd-5.2.1",
    "origin": "official",
    "pages": [
      363
    ],
    "section": "Animals/Venomous Snake",
    "license": {
      "id": "CC-BY-4.0",
      "attribution": "This work includes material from the System Reference Document 5.2.1 (“SRD 5.2.1”) by Wizards of the Coast LLC, available at https://www.dndbeyond.com/srd. The SRD 5.2.1 is licensed under the Creative Commons Attribution 4.0 International License, available at https://creativecommons.org/licenses/by/4.0/legalcode."
    },
    "extracted_by": "L40"
  },
  "tier": 2,
  "text": "*Tiny Beast, Unaligned*\n\n| **AC** 12 | **Initiative** +2 (12) |\n\n**HP** 5 (2d4)\n\n**Speed** 30 ft., Swim 30 ft.\n\n| MOD SAVE | MOD SAVE | MOD SAVE |\n| **Str** | 2 | −4 | −4 | **Dex** 15 | +2 | +2 | **Con** 11 | +0 | +0 |\n| **Int** | 1 | −5 | −5 | **Wis** 10 | +0 | +0 | **Cha** 3 | −4 | −4 |\n\n**Senses** Blindsight 10 ft.; Passive Perception 10\n\n**Languages** None\n\n**CR** 1/8 (XP 25; PB +2)\n\n##### Actions\n\n***Bite.*** *Melee Attack Roll:* +4, reach 5 ft. *Hit:* 4 (1d4 + 2) Piercing damage plus 3 (1d6) Poison damage.",
  "facets": {
    "group": "animal",
    "size": "Tiny",
    "type": "Beast",
    "alignment": "Unaligned",
    "cr": "1/8"
  },
  "data": {
    "size": "Tiny",
    "type": "Beast",
    "alignment": "Unaligned",
    "type_line": "Tiny Beast, Unaligned",
    "ac": {
      "value": 12,
      "text": "12"
    },
    "initiative": {
      "modifier": 2,
      "score": 12,
      "text": "+2 (12)"
    },
    "hp": {
      "average": 5,
      "formula": "2d4",
      "text": "5 (2d4)"
    },
    "speed": {
      "text": "30 ft., Swim 30 ft.",
      "walk": 30,
      "swim": 30
    },
    "abilities": {
      "str": {
        "score": 2,
        "mod": -4,
        "save": -4
      },
      "dex": {
        "score": 15,
        "mod": 2,
        "save": 2
      },
      "con": {
        "score": 11,
        "mod": 0,
        "save": 0
      },
      "int": {
        "score": 1,
        "mod": -5,
        "save": -5
      },
      "wis": {
        "score": 10,
        "mod": 0,
        "save": 0
      },
      "cha": {
        "score": 3,
        "mod": -4,
        "save": -4
      }
    },
    "senses": {
      "text": "Blindsight 10 ft.; Passive Perception 10",
      "blindsight": 10,
      "passive_perception": 10
    },
    "languages": {
      "text": "None"
    },
    "cr": {
      "value": "1/8",
      "xp": 25,
      "proficiency_bonus": 2,
      "text": "1/8 (XP 25; PB +2)"
    },
    "actions": [
      {
        "name": "Bite",
        "text": "*Melee Attack Roll:* +4, reach 5 ft. *Hit:* 4 (1d4 + 2) Piercing damage plus 3 (1d6) Poison damage."
      }
    ]
  },
  "effects": [
    {
      "op": "activation",
      "cost": "action",
      "name": "Bite",
      "then": [
        {
          "op": "attack",
          "attack_type": "melee",
          "bonus": 4,
          "on_hit": [
            {
              "op": "damage",
              "amount": {
                "op": "add",
                "args": [
                  "1d4",
                  2
                ]
              },
              "damage_type": "piercing"
            },
            {
              "op": "damage",
              "amount": "1d6",
              "damage_type": "poison"
            }
          ]
        }
      ],
      "action": "dnd5e/action/attack"
    }
  ],
  "coverage": [
    {
      "text": "*Tiny Beast, Unaligned*",
      "status": "structured",
      "by": [
        "/data/type_line",
        "/data/size",
        "/data/type",
        "/data/alignment"
      ]
    },
    {
      "text": "| **AC** 12 | **Initiative** +2 (12) |",
      "status": "structured",
      "by": [
        "/data/ac",
        "/data/initiative"
      ]
    },
    {
      "text": "**HP** 5 (2d4)",
      "status": "structured",
      "by": [
        "/data/hp"
      ]
    },
    {
      "text": "**Speed** 30 ft., Swim 30 ft.",
      "status": "structured",
      "by": [
        "/data/speed"
      ]
    },
    {
      "text": "| MOD SAVE | MOD SAVE | MOD SAVE |\n| **Str** | 2 | −4 | −4 | **Dex** 15 | +2 | +2 | **Con** 11 | +0 | +0 |\n| **Int** | 1 | −5 | −5 | **Wis** 10 | +0 | +0 | **Cha** 3 | −4 | −4 |",
      "status": "structured",
      "by": [
        "/data/abilities"
      ]
    },
    {
      "text": "**Senses** Blindsight 10 ft.; Passive Perception 10",
      "status": "structured",
      "by": [
        "/data/senses"
      ]
    },
    {
      "text": "**Languages** None",
      "status": "structured",
      "by": [
        "/data/languages"
      ]
    },
    {
      "text": "**CR** 1/8 (XP 25; PB +2)",
      "status": "structured",
      "by": [
        "/data/cr"
      ]
    },
    {
      "text": "##### Actions",
      "status": "structured",
      "by": [
        "/data/actions"
      ]
    },
    {
      "text": "***Bite.*** *Melee Attack Roll:* +4, reach 5 ft. *Hit:* 4 (1d4 + 2) Piercing damage plus 3 (1d6) Poison damage.",
      "status": "structured",
      "by": [
        "/data/actions/0",
        "/effects/0"
      ]
    }
  ]
}
