{
  "$schema": "../../../../schema/catalog_entry.schema.json",
  "ref": "dnd5e/spell/mirror-image",
  "kind": "spell",
  "name": "Mirror Image",
  "schema_version": "1.0",
  "source": {
    "system": "dnd5e",
    "document": "srd-5.2.1",
    "origin": "official",
    "pages": [
      150
    ],
    "section": "Spells/Spell Descriptions/Mirror Image",
    "license": {
      "id": "CC-BY-4.0",
      "attribution": "This work includes material from the System Reference Document 5.2.1 (“SRD 5.2.1”) by Wizards of the Coast LLC, available at https://www.dndbeyond.com/srd. The SRD 5.2.1 is licensed under the Creative Commons Attribution 4.0 International License, available at https://creativecommons.org/licenses/by/4.0/legalcode."
    },
    "extracted_by": "L19"
  },
  "tier": 2,
  "text": "*Level 2 Illusion (Bard, Sorcerer, Warlock, Wizard)*\n\n**Casting Time:** Action\n\n**Range:** Self\n\n**Components:** V, S\n\n**Duration:** 1 minute\n\nThree illusory duplicates of yourself appear in your space. Until the spell ends, the duplicates move with you and mimic your actions, shifting position so it’s impossible to track which image is real.\n\nEach time a creature hits you with an attack roll during the spell’s duration, roll a d6 for each of your remaining duplicates. If any of the d6s rolls a 3 or higher, one of the duplicates is hit instead of you, and the duplicate is destroyed. The duplicates otherwise ignore all other damage and effects. The spell ends when all three duplicates are destroyed.\n\nA creature is unaffected by this spell if it has the Blinded condition, Blindsight, or Truesight.",
  "facets": {
    "level": 2,
    "school": "illusion",
    "classes": [
      "bard",
      "sorcerer",
      "warlock",
      "wizard"
    ],
    "concentration": false,
    "ritual": false
  },
  "data": {
    "casting_time": {
      "text": "Action",
      "cost": "action"
    },
    "range": {
      "kind": "self"
    },
    "components": {
      "verbal": true,
      "somatic": true
    },
    "duration": {
      "text": "1 minute",
      "kind": "minutes",
      "amount": 1
    },
    "rules": [
      {
        "id": "duplicates",
        "count": 3
      },
      {
        "id": "unaffected",
        "if": [
          "blinded",
          "blindsight",
          "truesight"
        ]
      }
    ]
  },
  "effects": [
    {
      "op": "trigger",
      "event": {
        "event": "hit_by_attack_roll"
      },
      "duration": {
        "kind": "minutes",
        "amount": 1
      },
      "condition": {
        "not": {
          "pred": "attacker_perceives_with",
          "args": {
            "senses": [
              "blindsight",
              "truesight"
            ]
          }
        }
      },
      "then": [
        {
          "op": "reference",
          "rule": "dnd5e/spell/mirror-image",
          "note": "Roll a d6 per remaining duplicate; on any 3+, a duplicate is hit and destroyed instead."
        }
      ]
    }
  ],
  "coverage": [
    {
      "text": "*Level 2 Illusion (Bard, Sorcerer, Warlock, Wizard)*\n\n**Casting Time:** Action\n\n**Range:** Self\n\n**Components:** V, S\n\n**Duration:** 1 minute",
      "status": "structured",
      "by": [
        "/facets",
        "/data/casting_time",
        "/data/range",
        "/data/components",
        "/data/duration"
      ]
    },
    {
      "text": "Three illusory duplicates of yourself appear in your space. Until the spell ends, the duplicates move with you and mimic your actions, shifting position so it’s impossible to track which image is real.",
      "status": "structured",
      "by": [
        "/data/rules/0"
      ]
    },
    {
      "text": "Each time a creature hits you with an attack roll during the spell’s duration, roll a d6 for each of your remaining duplicates. If any of the d6s rolls a 3 or higher, one of the duplicates is hit instead of you, and the duplicate is destroyed. The duplicates otherwise ignore all other damage and effects. The spell ends when all three duplicates are destroyed.",
      "status": "structured",
      "by": [
        "/effects/0"
      ]
    },
    {
      "text": "A creature is unaffected by this spell if it has the Blinded condition, Blindsight, or Truesight.",
      "status": "structured",
      "by": [
        "/data/rules/1"
      ]
    }
  ],
  "refs": [
    "dnd5e/spell/mirror-image"
  ]
}
