{
  "$schema": "../../../../schema/catalog_entry.schema.json",
  "ref": "dnd5e/spell/true-strike",
  "kind": "spell",
  "name": "True Strike",
  "schema_version": "1.0",
  "source": {
    "system": "dnd5e",
    "document": "srd-5.2.1",
    "origin": "official",
    "pages": [
      171
    ],
    "section": "Spells/Spell Descriptions/True Strike",
    "license": {
      "id": "CC-BY-4.0",
      "attribution": "This work includes material from the System Reference Document 5.2.1 (“SRD 5.2.1”) by Wizards of the Coast LLC, available at https://www.dndbeyond.com/srd. The SRD 5.2.1 is licensed under the Creative Commons Attribution 4.0 International License, available at https://creativecommons.org/licenses/by/4.0/legalcode."
    },
    "extracted_by": "L17"
  },
  "tier": 2,
  "text": "*Divination Cantrip (Bard, Sorcerer, Warlock, Wizard)*\n\n**Casting Time:** Action\n\n**Range:** Self\n\n**Components:** S, M (a weapon with which you have proficiency and that is worth 1+ CP)\n\n**Duration:** Instantaneous\n\nGuided by a flash of magical insight, you make one attack with the weapon used in the spell’s casting. The attack uses your spellcasting ability for the attack and damage rolls instead of using Strength or Dexterity. If the attack deals damage, it can be Radiant damage or the weapon’s normal damage type (your choice).\n\n***Cantrip Upgrade.*** Whether you deal Radiant damage or the weapon’s normal damage type, the attack deals extra Radiant damage when you reach levels 5 (1d6), 11 (2d6), and 17 (3d6).",
  "facets": {
    "level": 0,
    "school": "divination",
    "classes": [
      "bard",
      "sorcerer",
      "warlock",
      "wizard"
    ],
    "concentration": false,
    "ritual": false
  },
  "data": {
    "casting_time": {
      "text": "Action",
      "cost": "action"
    },
    "range": {
      "kind": "self"
    },
    "components": {
      "verbal": false,
      "somatic": true,
      "material": "a weapon with which you have proficiency and that is worth 1+ CP"
    },
    "duration": {
      "kind": "instantaneous",
      "text": "Instantaneous"
    },
    "rules": [
      {
        "id": "damage_type",
        "choose_from": [
          "radiant",
          "normal_damage_type"
        ]
      }
    ]
  },
  "effects": [
    {
      "op": "choice",
      "id": "weapon_attack",
      "choose": 1,
      "options": [
        {
          "id": "melee_weapon",
          "label": "Melee Weapon",
          "effects": [
            {
              "op": "attack",
              "attack_type": "melee_weapon"
            }
          ]
        },
        {
          "id": "ranged_weapon",
          "label": "Ranged Weapon",
          "effects": [
            {
              "op": "attack",
              "attack_type": "ranged_weapon"
            }
          ]
        }
      ],
      "note": "One attack with the weapon used in the casting."
    },
    {
      "op": "modifier",
      "stat": "attack_ability",
      "mode": "set",
      "value": {
        "var": "spellcasting_mod"
      },
      "note": "Attack and damage rolls of that attack, instead of Strength or Dexterity."
    },
    {
      "op": "trigger",
      "event": {
        "event": "hits_with_attack_roll"
      },
      "then": [
        {
          "op": "damage",
          "amount": {
            "dice": {
              "count": {
                "scale": {
                  "by": "level",
                  "steps": [
                    {
                      "from": 5,
                      "value": 1
                    },
                    {
                      "from": 11,
                      "value": 2
                    },
                    {
                      "from": 17,
                      "value": 3
                    }
                  ]
                }
              },
              "faces": 6
            }
          },
          "damage_type": "radiant",
          "target": {
            "kind": "inherit"
          }
        }
      ],
      "condition": {
        "pred": "character_level_at_least",
        "args": {
          "level": 5
        }
      }
    }
  ],
  "coverage": [
    {
      "text": "*Divination Cantrip (Bard, Sorcerer, Warlock, Wizard)*\n\n**Casting Time:** Action\n\n**Range:** Self\n\n**Components:** S, M (a weapon with which you have proficiency and that is worth 1+ CP)\n\n**Duration:** Instantaneous",
      "status": "structured",
      "by": [
        "/facets",
        "/data/casting_time",
        "/data/range",
        "/data/components",
        "/data/duration"
      ]
    },
    {
      "text": "Guided by a flash of magical insight, you make one attack with the weapon used in the spell’s casting. The attack uses your spellcasting ability for the attack and damage rolls instead of using Strength or Dexterity. If the attack deals damage, it can be Radiant damage or the weapon’s normal damage type (your choice).",
      "status": "structured",
      "by": [
        "/effects/0",
        "/effects/1",
        "/data/rules/0"
      ]
    },
    {
      "text": "***Cantrip Upgrade.*** Whether you deal Radiant damage or the weapon’s normal damage type, the attack deals extra Radiant damage when you reach levels 5 (1d6), 11 (2d6), and 17 (3d6).",
      "status": "structured",
      "by": [
        "/effects/2"
      ]
    }
  ]
}
