{
  "$schema": "../../../../schema/catalog_entry.schema.json",
  "ref": "dnd5e/rule/curses-and-magical-contagions",
  "kind": "rule",
  "name": "Curses and Magical Contagions",
  "schema_version": "1.0",
  "source": {
    "system": "dnd5e",
    "document": "srd-5.2.1",
    "origin": "official",
    "pages": [
      193
    ],
    "section": "Gameplay Toolbox/Curses and Magical Contagions",
    "license": {
      "id": "CC-BY-4.0",
      "attribution": "This work includes material from the System Reference Document 5.2.1 (“SRD 5.2.1”) by Wizards of the Coast LLC, available at https://www.dndbeyond.com/srd. The SRD 5.2.1 is licensed under the Creative Commons Attribution 4.0 International License, available at https://creativecommons.org/licenses/by/4.0/legalcode."
    },
    "extracted_by": "L41"
  },
  "tier": 1,
  "text": "A curse is a magical burden that lasts for a specified time or until it is ended by some means. A magical contagion is an adverse effect of magical origin that is contagious by definition.\n\nThe following sections discuss curses and magical contagions in detail.",
  "data": {
    "rules": [
      {
        "id": "definitions",
        "curse": "magical burden until ended",
        "contagion": "contagious magical adverse effect"
      }
    ]
  },
  "coverage": [
    {
      "text": "A curse is a magical burden that lasts for a specified time or until it is ended by some means. A magical contagion is an adverse effect of magical origin that is contagious by definition.\n\nThe following sections discuss curses and magical contagions in detail.",
      "status": "structured",
      "by": [
        "/data/rules/0"
      ]
    }
  ]
}
