{
  "$schema": "../../../../schema/catalog_entry.schema.json",
  "ref": "dnd5e/magic-item/helm-of-telepathy",
  "kind": "magic-item",
  "name": "Helm of Telepathy",
  "schema_version": "1.0",
  "source": {
    "system": "dnd5e",
    "document": "srd-5.2.1",
    "origin": "official",
    "pages": [
      226
    ],
    "section": "Magic Items/Magic Items A–Z/Helm of Telepathy",
    "license": {
      "id": "CC-BY-4.0",
      "attribution": "This work includes material from the System Reference Document 5.2.1 (“SRD 5.2.1”) by Wizards of the Coast LLC, available at https://www.dndbeyond.com/srd. The SRD 5.2.1 is licensed under the Creative Commons Attribution 4.0 International License, available at https://creativecommons.org/licenses/by/4.0/legalcode."
    },
    "extracted_by": "L31"
  },
  "tier": 2,
  "text": "*Wondrous Item, Uncommon (Requires Attunement)*\n\nWhile wearing this helm, you have telepathy with a range of 30 feet, and you can cast *Detect Thoughts* or *Suggestion* (save DC 13) from the helm. Once either spell is cast from the helm, that spell can’t be cast from it again until the next dawn.",
  "facets": {
    "category": "wondrous_item",
    "rarity": [
      "uncommon"
    ],
    "attunement": true
  },
  "data": {
    "item": {
      "type_line": "Wondrous Item, Uncommon (Requires Attunement)",
      "attunement": {
        "required": true
      },
      "category": "wondrous_item",
      "rarity": [
        {
          "rarity": "uncommon"
        }
      ]
    }
  },
  "effects": [
    {
      "op": "sense",
      "sense": "telepathy",
      "range_feet": 30,
      "when": {
        "pred": "item_state",
        "args": {
          "state": "worn",
          "item": "this"
        }
      }
    },
    {
      "op": "activation",
      "cost": "action",
      "action": "dnd5e/action/magic",
      "frequency": {
        "count": 1,
        "per": "dawn"
      },
      "then": [
        {
          "op": "cast_spell",
          "spell": "dnd5e/spell/detect-thoughts",
          "slot": "none",
          "components": [],
          "save_dc": 13
        }
      ],
      "requires": {
        "pred": "item_state",
        "args": {
          "state": "worn",
          "item": "this"
        }
      }
    },
    {
      "op": "activation",
      "cost": "action",
      "action": "dnd5e/action/magic",
      "frequency": {
        "count": 1,
        "per": "dawn"
      },
      "then": [
        {
          "op": "cast_spell",
          "spell": "dnd5e/spell/suggestion",
          "slot": "none",
          "components": [],
          "save_dc": 13
        }
      ],
      "requires": {
        "pred": "item_state",
        "args": {
          "state": "worn",
          "item": "this"
        }
      }
    }
  ],
  "coverage": [
    {
      "text": "*Wondrous Item, Uncommon (Requires Attunement)*",
      "status": "structured",
      "by": [
        "/facets",
        "/data/item"
      ]
    },
    {
      "text": "While wearing this helm, you have telepathy with a range of 30 feet, and you can cast *Detect Thoughts* or *Suggestion* (save DC 13) from the helm. Once either spell is cast from the helm, that spell can’t be cast from it again until the next dawn.",
      "status": "structured",
      "by": [
        "/effects/0",
        "/effects/1",
        "/effects/2"
      ]
    }
  ],
  "refs": [
    "dnd5e/spell/detect-thoughts",
    "dnd5e/spell/suggestion"
  ]
}
