{
  "$schema": "../../../../schema/catalog_entry.schema.json",
  "ref": "dnd5e/rule/mounts-and-vehicles",
  "kind": "rule",
  "name": "Mounts and Vehicles",
  "schema_version": "1.0",
  "source": {
    "system": "dnd5e",
    "document": "srd-5.2.1",
    "origin": "official",
    "pages": [
      100
    ],
    "section": "Equipment/Mounts and Vehicles",
    "license": {
      "id": "CC-BY-4.0",
      "attribution": "This work includes material from the System Reference Document 5.2.1 (“SRD 5.2.1”) by Wizards of the Coast LLC, available at https://www.dndbeyond.com/srd. The SRD 5.2.1 is licensed under the Creative Commons Attribution 4.0 International License, available at https://creativecommons.org/licenses/by/4.0/legalcode."
    },
    "extracted_by": "L30"
  },
  "tier": 1,
  "text": "A mount can help you move more quickly through the wilderness, but its primary purpose is to carry gear that would otherwise slow you down. The Mounts and Other Animals table shows each animal’s carrying capacity. See “Monsters” for the animals’ stat blocks.",
  "data": {
    "rules": [
      {
        "id": "mounts",
        "purpose": "carry_gear",
        "stat_blocks": "dnd5e/rule/monster"
      }
    ]
  },
  "coverage": [
    {
      "text": "A mount can help you move more quickly through the wilderness, but its primary purpose is to carry gear that would otherwise slow you down. The Mounts and Other Animals table shows each animal’s carrying capacity. See “Monsters” for the animals’ stat blocks.",
      "status": "structured",
      "by": [
        "/data/rules/0"
      ]
    }
  ]
}
