{
  "$schema": "../../../../schema/catalog_entry.schema.json",
  "ref": "dnd5e/creature/hawk",
  "kind": "creature",
  "name": "Hawk",
  "schema_version": "1.0",
  "source": {
    "system": "dnd5e",
    "document": "srd-5.2.1",
    "origin": "official",
    "pages": [
      355
    ],
    "section": "Animals/Hawk",
    "license": {
      "id": "CC-BY-4.0",
      "attribution": "This work includes material from the System Reference Document 5.2.1 (“SRD 5.2.1”) by Wizards of the Coast LLC, available at https://www.dndbeyond.com/srd. The SRD 5.2.1 is licensed under the Creative Commons Attribution 4.0 International License, available at https://creativecommons.org/licenses/by/4.0/legalcode."
    },
    "extracted_by": "L35"
  },
  "tier": 2,
  "text": "*Tiny Beast, Unaligned*\n\n| **AC** 13 | **Initiative** +3 (13) |\n\n**HP** 1 (1d4 − 1)\n\n**Speed** 10 ft., Fly 60 ft.\n\n| MOD SAVE | MOD SAVE | MOD SAVE |\n| **Str** | 5 | −3 | −3 | **Dex** 16 | +3 | +3 | **Con** 8 | −1 | −1 |\n| **Int** | 2 | −4 | −4 | **Wis** 14 | +2 | +2 | **Cha** 6 | −2 | −2 |\n\n**Skills** Perception +6\n\n**Senses** Passive Perception 16\n\n**Languages** None\n\n**CR** 0 (XP 10; PB +2)\n\n##### Actions\n\n***Talons.*** *Melee Attack Roll:* +5, reach 5 ft. *Hit:* 1 Slashing damage.",
  "facets": {
    "group": "animal",
    "size": "Tiny",
    "type": "Beast",
    "alignment": "Unaligned",
    "cr": "0"
  },
  "data": {
    "size": "Tiny",
    "type": "Beast",
    "alignment": "Unaligned",
    "type_line": "Tiny Beast, Unaligned",
    "ac": {
      "value": 13,
      "text": "13"
    },
    "initiative": {
      "modifier": 3,
      "score": 13,
      "text": "+3 (13)"
    },
    "hp": {
      "average": 1,
      "formula": {
        "op": "sub",
        "args": [
          "1d4",
          1
        ]
      },
      "text": "1 (1d4 − 1)"
    },
    "speed": {
      "text": "10 ft., Fly 60 ft.",
      "walk": 10,
      "fly": 60
    },
    "abilities": {
      "str": {
        "score": 5,
        "mod": -3,
        "save": -3
      },
      "dex": {
        "score": 16,
        "mod": 3,
        "save": 3
      },
      "con": {
        "score": 8,
        "mod": -1,
        "save": -1
      },
      "int": {
        "score": 2,
        "mod": -4,
        "save": -4
      },
      "wis": {
        "score": 14,
        "mod": 2,
        "save": 2
      },
      "cha": {
        "score": 6,
        "mod": -2,
        "save": -2
      }
    },
    "skills": {
      "perception": 6,
      "text": "Perception +6"
    },
    "senses": {
      "text": "Passive Perception 16",
      "passive_perception": 16
    },
    "languages": {
      "text": "None"
    },
    "cr": {
      "value": "0",
      "xp": 10,
      "proficiency_bonus": 2,
      "text": "0 (XP 10; PB +2)"
    },
    "actions": [
      {
        "name": "Talons",
        "text": "*Melee Attack Roll:* +5, reach 5 ft. *Hit:* 1 Slashing damage."
      }
    ]
  },
  "effects": [
    {
      "op": "activation",
      "cost": "action",
      "name": "Talons",
      "then": [
        {
          "op": "attack",
          "attack_type": "melee",
          "bonus": 5,
          "on_hit": [
            {
              "op": "damage",
              "amount": 1,
              "damage_type": "slashing"
            }
          ]
        }
      ],
      "action": "dnd5e/action/attack"
    }
  ],
  "coverage": [
    {
      "text": "*Tiny Beast, Unaligned*",
      "status": "structured",
      "by": [
        "/data/type_line",
        "/data/size",
        "/data/type",
        "/data/alignment"
      ]
    },
    {
      "text": "| **AC** 13 | **Initiative** +3 (13) |",
      "status": "structured",
      "by": [
        "/data/ac",
        "/data/initiative"
      ]
    },
    {
      "text": "**HP** 1 (1d4 − 1)",
      "status": "structured",
      "by": [
        "/data/hp"
      ]
    },
    {
      "text": "**Speed** 10 ft., Fly 60 ft.",
      "status": "structured",
      "by": [
        "/data/speed"
      ]
    },
    {
      "text": "| MOD SAVE | MOD SAVE | MOD SAVE |\n| **Str** | 5 | −3 | −3 | **Dex** 16 | +3 | +3 | **Con** 8 | −1 | −1 |\n| **Int** | 2 | −4 | −4 | **Wis** 14 | +2 | +2 | **Cha** 6 | −2 | −2 |",
      "status": "structured",
      "by": [
        "/data/abilities"
      ]
    },
    {
      "text": "**Skills** Perception +6",
      "status": "structured",
      "by": [
        "/data/skills"
      ]
    },
    {
      "text": "**Senses** Passive Perception 16",
      "status": "structured",
      "by": [
        "/data/senses"
      ]
    },
    {
      "text": "**Languages** None",
      "status": "structured",
      "by": [
        "/data/languages"
      ]
    },
    {
      "text": "**CR** 0 (XP 10; PB +2)",
      "status": "structured",
      "by": [
        "/data/cr"
      ]
    },
    {
      "text": "##### Actions",
      "status": "structured",
      "by": [
        "/data/actions"
      ]
    },
    {
      "text": "***Talons.*** *Melee Attack Roll:* +5, reach 5 ft. *Hit:* 1 Slashing damage.",
      "status": "structured",
      "by": [
        "/data/actions/0",
        "/effects/0"
      ]
    }
  ]
}
