{
  "$schema": "../../../../schema/catalog_entry.schema.json",
  "ref": "dnd5e/rule/school-of-magic",
  "kind": "rule",
  "name": "School of Magic",
  "schema_version": "1.0",
  "source": {
    "system": "dnd5e",
    "document": "srd-5.2.1",
    "origin": "official",
    "pages": [
      105
    ],
    "section": "Spells/Casting Spells/School of Magic",
    "license": {
      "id": "CC-BY-4.0",
      "attribution": "This work includes material from the System Reference Document 5.2.1 (“SRD 5.2.1”) by Wizards of the Coast LLC, available at https://www.dndbeyond.com/srd. The SRD 5.2.1 is licensed under the Creative Commons Attribution 4.0 International License, available at https://creativecommons.org/licenses/by/4.0/legalcode."
    },
    "extracted_by": "L09"
  },
  "tier": 0,
  "text": "Each spell belongs to a school of magic. The schools are listed in the Schools of Magic table. These categories help describe spells but have no rules of their own, although some other rules refer to them.\n\n##### Schools of Magic\n\n| **School** | **Typical Effects** |\n| Abjuration | Prevents or reverses harmful effects |\n| Conjuration | Transports creatures or objects |\n| Divination | Reveals information |\n| Enchantment | Influences minds |\n| Evocation | Channels energy to create effects that are often destructive |\n| Illusion | Deceives the mind or senses |\n| Necromancy | Manipulates life and death |\n| Transmutation | Transforms creatures or objects |",
  "coverage": [
    {
      "text": "Each spell belongs to a school of magic. The schools are listed in the Schools of Magic table. These categories help describe spells but have no rules of their own, although some other rules refer to them.\n\n##### Schools of Magic\n\n| **School** | **Typical Effects** |\n| Abjuration | Prevents or reverses harmful effects |\n| Conjuration | Transports creatures or objects |\n| Divination | Reveals information |\n| Enchantment | Influences minds |\n| Evocation | Channels energy to create effects that are often destructive |\n| Illusion | Deceives the mind or senses |\n| Necromancy | Manipulates life and death |\n| Transmutation | Transforms creatures or objects |",
      "status": "structured",
      "by": [
        "dnd5e/system/dnd5e#/registries/schools"
      ]
    }
  ],
  "refs": [
    "dnd5e/system/dnd5e"
  ]
}
