{
  "$schema": "../../../../schema/catalog_entry.schema.json",
  "ref": "dnd5e/rule/spell-duration",
  "kind": "rule",
  "name": "Duration",
  "schema_version": "1.0",
  "source": {
    "system": "dnd5e",
    "document": "srd-5.2.1",
    "origin": "official",
    "pages": [
      106
    ],
    "section": "Spells/Casting Spells/Duration",
    "license": {
      "id": "CC-BY-4.0",
      "attribution": "This work includes material from the System Reference Document 5.2.1 (“SRD 5.2.1”) by Wizards of the Coast LLC, available at https://www.dndbeyond.com/srd. The SRD 5.2.1 is licensed under the Creative Commons Attribution 4.0 International License, available at https://creativecommons.org/licenses/by/4.0/legalcode."
    },
    "extracted_by": "L09"
  },
  "tier": 1,
  "text": "A spell’s duration is the length of time the spell persists after it is cast. A duration typically takes one of the following forms:\n\n**Concentration.** A duration that requires Concentration follows the Concentration rules (see “Rules Glossary”).\n\n**Instantaneous.** An instantaneous duration means the spell’s magic appears only for a moment and then disappears.\n\n**Time Span.** A duration that provides a time span specifies how long the spell lasts in rounds, minutes, hours, or the like. For example, a Duration entry might say “1 minute,” meaning the spell ends after 1 minute has passed. While a time-span spell that you cast is ongoing, you can dismiss it (no action required) if you don’t have the Incapacitated condition.",
  "data": {
    "rules": [
      {
        "id": "instantaneous",
        "persists": false
      },
      {
        "id": "time_span",
        "dismiss_cost": "none",
        "dismiss_requires": {
          "not": {
            "pred": "has_condition",
            "args": {
              "condition": "incapacitated"
            }
          }
        }
      }
    ]
  },
  "coverage": [
    {
      "text": "A spell’s duration is the length of time the spell persists after it is cast. A duration typically takes one of the following forms:",
      "status": "descriptive"
    },
    {
      "text": "**Concentration.** A duration that requires Concentration follows the Concentration rules (see “Rules Glossary”).",
      "status": "shared_rule",
      "by": [
        "dnd5e/rule/concentration"
      ]
    },
    {
      "text": "**Instantaneous.** An instantaneous duration means the spell’s magic appears only for a moment and then disappears.",
      "status": "structured",
      "by": [
        "/data/rules/0"
      ]
    },
    {
      "text": "**Time Span.** A duration that provides a time span specifies how long the spell lasts in rounds, minutes, hours, or the like. For example, a Duration entry might say “1 minute,” meaning the spell ends after 1 minute has passed. While a time-span spell that you cast is ongoing, you can dismiss it (no action required) if you don’t have the Incapacitated condition.",
      "status": "structured",
      "by": [
        "/data/rules/1"
      ]
    }
  ],
  "refs": [
    "dnd5e/rule/concentration"
  ]
}
