{
  "$schema": "../../../../schema/catalog_entry.schema.json",
  "ref": "dnd5e/spell-list/fiend-spells",
  "kind": "spell-list",
  "name": "Fiend Spells",
  "schema_version": "1.0",
  "source": {
    "system": "dnd5e",
    "document": "srd-5.2.1",
    "origin": "official",
    "pages": [
      76
    ],
    "section": "Classes/Warlock/Fiend Spells",
    "license": {
      "id": "CC-BY-4.0",
      "attribution": "This work includes material from the System Reference Document 5.2.1 (“SRD 5.2.1”) by Wizards of the Coast LLC, available at https://www.dndbeyond.com/srd. The SRD 5.2.1 is licensed under the Creative Commons Attribution 4.0 International License, available at https://creativecommons.org/licenses/by/4.0/legalcode."
    },
    "extracted_by": "L27"
  },
  "tier": 1,
  "text": "##### Fiend Spells\n\n| **Warlock Level** | **Spells** |\n| 3 | *Burning Hands*, *Command*, *Scorching Ray*, *Suggestion* |\n| 5 | *Fireball*, *Stinking Cloud* |\n| 7 | *Fire Shield*, *Wall of Fire* |\n| 9 | *Geas*, *Insect Plague* |",
  "facets": {
    "class": "dnd5e/class/warlock",
    "subclass_list": true,
    "spell_count": 10
  },
  "data": {
    "class": "dnd5e/class/warlock",
    "granted_by": "dnd5e/feature/fiend-patron-fiend-spells",
    "always_prepared": true,
    "by_level": [
      {
        "class_level": 3,
        "spells": [
          "dnd5e/spell/burning-hands",
          "dnd5e/spell/command",
          "dnd5e/spell/scorching-ray",
          "dnd5e/spell/suggestion"
        ]
      },
      {
        "class_level": 5,
        "spells": [
          "dnd5e/spell/fireball",
          "dnd5e/spell/stinking-cloud"
        ]
      },
      {
        "class_level": 7,
        "spells": [
          "dnd5e/spell/fire-shield",
          "dnd5e/spell/wall-of-fire"
        ]
      },
      {
        "class_level": 9,
        "spells": [
          "dnd5e/spell/geas",
          "dnd5e/spell/insect-plague"
        ]
      }
    ],
    "spells": [
      "dnd5e/spell/burning-hands",
      "dnd5e/spell/command",
      "dnd5e/spell/scorching-ray",
      "dnd5e/spell/suggestion",
      "dnd5e/spell/fireball",
      "dnd5e/spell/stinking-cloud",
      "dnd5e/spell/fire-shield",
      "dnd5e/spell/wall-of-fire",
      "dnd5e/spell/geas",
      "dnd5e/spell/insect-plague"
    ]
  },
  "coverage": [
    {
      "text": "##### Fiend Spells\n\n| **Warlock Level** | **Spells** |\n| 3 | *Burning Hands*, *Command*, *Scorching Ray*, *Suggestion* |\n| 5 | *Fireball*, *Stinking Cloud* |\n| 7 | *Fire Shield*, *Wall of Fire* |\n| 9 | *Geas*, *Insect Plague* |",
      "status": "structured",
      "by": [
        "/data/by_level",
        "/data/spells",
        "dnd5e/feature/fiend-patron-fiend-spells"
      ]
    }
  ],
  "refs": [
    "dnd5e/feature/fiend-patron-fiend-spells",
    "dnd5e/spell/burning-hands",
    "dnd5e/spell/command",
    "dnd5e/spell/fire-shield",
    "dnd5e/spell/fireball",
    "dnd5e/spell/geas",
    "dnd5e/spell/insect-plague",
    "dnd5e/spell/scorching-ray",
    "dnd5e/spell/stinking-cloud",
    "dnd5e/spell/suggestion",
    "dnd5e/spell/wall-of-fire"
  ]
}
